question_number,question_text,choices,o1_answer,o1_explanation,o1_confidence,gpt-4o_answer,gpt-4o_explanation,gpt-4o_confidence,o3-mini_answer,o3-mini_explanation,o3-mini_confidence,gemini_answer,gemini_explanation,gemini_confidence,deepseek_answer,deepseek_explanation,claude_answer,claude_explanation,claude_confidence,deepseek_confidence
119A53,"65歳の男性。全身倦怠感を主訴に来院した。2か月前の健康診断では腎機能障害の指摘はなかった。2週間前に細菌性肺炎のため、自宅近くの診療所で1週間の抗菌薬治療を受けた。肺炎は改善したが、3日前から全身倦怠感と尿量の減少を自覚している。身長170cm、体重62kg。体温36.5℃。脈拍72/分、整。血圧136/82mmHg。尿所見:蛋白(土)、糖1+、潜血(一)、沈渣に白血球10~19/HPF。β2-マイクログロブリン35,200μg/L(基準200以下)。血液所見:赤血球410万、Hb13.2g/dL、Ht38%、白血球9,200。血液生化学所見:総蛋白8.4g/dL、アルブミン4.2g/dL、尿素窒素36mg/dL、クレアチニン2.4mg/dL、血糖98mg/dL、HbAlc5.2%(基準4.9~6.0)。免疫血清学所見:抗核抗体陰性、C396mg/dL(基準52~112)、C430mg/dL(基準16~51)、ASO200単位(基準250以下)、MPO-ANCA陰性、PR3-ANCA陰性。最も考えられる疾患はどれか。 ",a. 膜性腎症 | b. 糖尿病腎症 | c. 急性間質性腎炎 | d. 急性糸球体腎炎 | e. 急速進行性糸球体腎炎,c,抗菌薬使用後の急性の腎機能障害と尿中β2-マイクログロブリンの著明上昇、尿沈渣での白血球増加から急性間質性腎炎が最も疑われるため。,0.9,c,患者は急性の腎機能障害と尿量の減少を呈しており、尿沈渣に白血球が多数認められます。これは急性間質性腎炎の特徴と一致します。抗菌薬の使用歴があり、これは急性間質性腎炎の原因となることがあります。他の選択肢では、この病歴や尿所見に合わないため最も可能性が高いのは急性間質性腎炎です。,0.9,c,最近の抗菌薬治療に起因する薬剤性急性間質性腎炎と考えられる。尿中β2‐マイクログロブリンの大幅な上昇や尿沈渣の白血球増加が、近位尿細管障害・間質炎症の所見であり、他の選択肢（膜性腎症、糖尿病腎症、急性・急速進行性糸球体腎炎）とは臨床像が一致しないため。,0.95,c,抗菌薬使用後の腎機能障害、尿所見（蛋白尿、白血球尿）、高値のβ2-マイクログロブリン血症から、薬剤性急性間質性腎炎が最も疑わしい。,0.9,ERROR,Expecting value: line 1 column 1 (char 0),c,以下の理由から急性間質性腎炎が最も考えられます：,0.9,
119A54,46歳の女性。人間ドックで血液検査の異常を指摘され、精査のため来院した。自覚症状はない。身長166cm、体重59kg。脈拍72/分、整。血圧126/82mmHg。血液生化学所見:アルブミン4.4g/dL、尿素窒素11mg/dL、クレアチニン0.5mg/dL、Na142mEq/L、K4.2mEq/L、C1104mEq/L、Ca11.2mg/dL、P3.4mg/dL、副甲状腺ホルモン102pg/mL(基準10~60)。頸部超音波像(別冊No.22)を別に示す。この疾患で正しいのはどれか。 ,a. 白内障を合併しやすい。 | b. 全身性の骨軟化症がみられる。 | c. 異所性ホルモン産生腫瘍である。 | d. 尿中カルシウム排泄率は増加する。 | e. 甲状腺癌に関連するカルシウム異常である。,d,原発性副甲状腺機能亢進症では高カルシウム血症により尿中への排泄が増加するため。,0.9,d,この患者は高カルシウム血症と副甲状腺ホルモン（pth）の上昇が見られ、副甲状腺機能亢進症が疑われます。この状態では、腎臓からのカルシウムの再吸収が増加し、尿中カルシウム排泄率が増加することがあります。他の選択肢は副甲状腺機能亢進症の典型的な特徴ではありません。,0.9,d,この症例は原発性副甲状腺機能亢進症であり、高カルシウム血症により尿中へのカルシウム排泄が増加するため。その他の選択肢は該当疾患の特徴とは異なる。,1.0,a,副甲状腺ホルモン(pth)高値と高カルシウム血症から原発性副甲状腺機能亢進症が考えられる。頸部超音波像で腫瘍が認められることから、腺腫による可能性が高い。原発性副甲状腺機能亢進症では、高カルシウム血症により白内障を合併しやすい。,0.9,ERROR,Expecting value: line 1 column 1 (char 0),d,この症例は原発性副甲状腺機能亢進症の典型的な所見を示しています。血清カルシウム高値（11.2mg/dl）、副甲状腺ホルモン高値（102pg/ml）が特徴的です。原発性副甲状腺機能亢進症では、副甲状腺ホルモンの過剰分泌により、腎臓でのカルシウム再吸収が抑制され、尿中カルシウム排泄が増加します。他の選択肢は誤りで、特にこの疾患では骨軟化症ではなく骨粗鬆症を引き起こし、異所性腫瘍でもなく、通常は副甲状腺腺腫が原因です。,0.9,
119A55,"72歳の女性(4妊2産)。多量の性器出血を主訴に救急車で搬入された。2年前から帯下の増量と不正性器出血を自覚していたが、家族には相談していなかった。3か月前から、出血量が増え、めまいも出現した。今朝トイレで多量の性器出血があり、家族が救急車を要請した。意識は清明。身長152cm、体重48kg。体温37.8℃。心拍数100/分、整。血圧110/74mmHg。腟鏡診で子宮頸部に易出血性の腫瘤を認めた。内診では腫瘤の可動性は不良で、両側で骨盤壁に及ぶ子宮傍結合組織浸潤を認めた。血液所見:赤血球238万、Hb6.9g/dL、Ht28%、白血球10,300、血小板21万。血液生化学所見:総蛋白5.9g/dL、アルブミン2.4g/dL、総ビリルビン0.9mg/dL、AST30U/L、ALT26U/L、LD250U/L(基準124222)、尿素窒素60mg/dL、クレアチニン2.8mg/dL、Na138mEq/L、K5.4mEq/L、C1105mEq/L、CEA3.8ng/mL(基準5以下)、CA12528U/mL(基準35以下)、SCC9.8ng/mL(基準1.5以下)。CRP5.7mg/dL。子宮頸部組織診で扁平上皮癌と診断された。胸腹部単純CTで子宮頸部に径5cmの腫瘍を認め、遠隔転移を認めない。この患者にまず行うべき治療はどれか。 ",a. 放射線治療 | b. 血管新生阻害薬 | c. 広汎子宮全摘出術 | d. シスプラチン動注 | e. 免疫チェックポイント阻害薬,a,骨盤壁への浸潤がある子宮頸がんiiib期相当であり，手術適応ではなく放射線（化学放射線）療法が第一選択となるため。,1.0,a,患者の症例は、子宮頸癌でかなり進行しており（骨盤壁への浸潤を認めている）、遠隔転移がないことから、広汎子宮全摘出術は難しいです。骨盤への浸潤があるため、手術よりもまずは放射線治療が適応されるケースが多いです。放射線治療は局所進行した子宮頸癌に対して標準的な治療法です。,0.9,a,この患者は子宮頸部扁平上皮癌であり、内診所見から骨盤壁まで及ぶ子宮傍結合組織浸潤が認められるため、figo分類で進行例（iiib相当）と考えられる。進行子宮頸がんでは、標準治療は放射線治療を基本とした併用化学放射線療法であるが、本例は腎機能障害（クレアチニン2.8mg/dl）のため、腎毒性のあるシスプラチンの併用は困難である。従って、まずは放射線治療を行うのが適切である。,1.0,a,子宮頸癌の進行期であり、手術適応からは外れる。遠隔転移がないため、放射線治療が適切な初期治療となる。sccが高値であることも扁平上皮癌を示唆する。,0.9,ERROR,Expecting value: line 1 column 1 (char 0),a,この症例は以下の理由から放射線治療が最適です：,0.9,
119A56,"56歳の女性。見当識障害を主訴に家族に付き添われて来院した。1週間前から37℃台の発熱が続き、昨日から自宅のトイレの場所が分からなくなった。下痢と血便はない。意識レベルはJCSI-2。体温37.8℃。脈拍88/分、整。血圧144/88mmHg。両下肢に点状出血を認める。眼瞼結膜は貧血様で、眼球結膜に軽度黄染を認める。胸骨左縁第3肋間を最強点とするLevine-2/6の収縮期雑音を聴取する。呼吸音に異常を認めない。尿所見:蛋白2+、潜血2+。血液所見:赤血球230万、Hb7.1g/dL、Ht20%、網赤血球5%、白血球8,890、血小板2.1万。末梢血塗抹標本で破砕赤血球を認める。PT-INR1.0(基準0.9~1.1)、APTT27.6秒(基準対照32.2)、FDP9μg/mL(基準10以下)。血液生化学所見:総ビリルビン2.9mg/dL、直接ビリルビン0.7mg/dL、AST48U/L、ALT42U/L、LD1,025U/L(基準124~222)、尿素窒素50mg/dL、クレアチニン1.9mg/dL。CRP0.8mg/dL。直ちに行うべき治療はどれか。 ",a. 血漿交換 | b. 血小板輸血 | c. 抗菌薬投与 | d. ヘパリン投与 | e. トロンボポエチン受容体作動薬投与,a,破砕赤血球を伴う貧血と血小板減少、神経症状を示す典型的なttpの所見であり，直ちに血漿交換を行う必要があるため。,1.0,a,この患者は、血管内での破砕赤血球の存在、貧血、血小板減少、腎機能障害、および神経症状があるため、血栓性血小板減少性紫斑病（ttp）が疑われます。ttpの治療としては、血漿交換が第一選択となります。,0.9,a,この症例は、微小血管性溶血性貧血（破砕赤血球、上昇ldh、低hb）、著明な血小板減少、神経症状、腎障害、そして微熱というttpの五徴候（完全な五徴候は必ずしも認められないが特徴的）を示しており、直ちに生命救助措置として血漿交換が必要となる。,1.0,a,見当識障害、発熱、下痢・血便なし、意識レベル低下、両下肢の点状出血、貧血、軽度黄染、収縮期雑音、蛋白尿、血尿、著明な貧血(hb 7.1 g/dl)、血小板減少(2.1万)、破砕赤血球の存在、ldh上昇、腎機能障害(bun/cr上昇)から、溶血性尿毒症症候群(hus)または血栓性血小板減少性紫斑病(ttp)が疑われる。pt-inrとapttが正常範囲内であることから、播種性血管内凝固症候群(dic)の可能性は低い。hus/ttpに対しては、直ちに血漿交換療法を行うことが推奨される。血小板輸血は禁忌である。抗菌薬投与は、腸管出血性大腸菌感染によるhusが疑われる場合に行われることがあるが、本症例では下痢・血便がないため、優先度は低い。ヘパリン投与は、dicや血栓症に対して行われることがあるが、本症例では適応とならない。トロンボポエチン受容体作動薬は、特発性血小板減少性紫斑病(itp)などに用いられるが、本症例では適応とならない。,0.95,ERROR,Expecting value: line 1 column 1 (char 0),a,この症例は血栓性血小板減少性紫斑病（ttp）の典型的な症状を示しています。,0.9,
119A57,65歳の女性。胸痛を主訴に来院した。高血圧症、脂質異常症、糖尿病および骨粗鬆症に対してそれぞれ内服治療中である。2か月前から明け方に冷汗を伴う5~10分程度の胸部絞扼感を自覚している。日中の労作時には同様の症状はない。冠動脈CTでは器質的冠動脈狭窄を認めなかった。午前4時にいつもと同様の胸部絞扼感を認め、ニトログリセリンを舌下したところ数十秒後に症状は消失したが心配になり受診した。身長158cm、体重56kg。体温36.1℃、脈拍72/分、整。血圧138/80mmHg。呼吸数14/分。SpO298%(roomair)。心音と呼吸音とに異常を認めない。四肢に異常を認めない。血液生化学所見:AST28U/L、LD177U/L(基準124~222)、CK42U/L(基準41~153)、尿素窒素12mg/dL、クレアチニン0.6mg/dL、血糖118mg/dL、HbAlc6.7%(基準4.9~6.0)、トリグリセリド160mg/dL、HDLコレステロール31mg/dL、LDLコレステロール138mg/dL。心筋トロポニンT迅速検査陰性。この患者にアセチルコリン負荷冠動脈造影検査を実施するにあたり、検査結果に影響を与える薬剤はどれか。 ,a. スタチン | b. DPP-4阻害薬 | c. カルシウム拮抗薬 | d. ビスホスホネート製剤 | e. アンジオテンシン受容体拮抗薬〈ARB〉,c,カルシウム拮抗薬は冠動脈の攣縮を抑制する作用があるため、アセチルコリン負荷検査の結果に影響を与える。,1.0,c,アセチルコリン負荷冠動脈造影検査は、異型狭心症の診断のために使用されることがあります。この検査では冠動脈の反応を観察しますが、カルシウム拮抗薬は冠動脈を拡張させる作用があるため、検査の結果に影響を与える可能性があります。他の選択肢の薬剤は直接的にこの種の検査結果には影響を与えないと考えられます。,0.9,c,カルシウム拮抗薬は冠動脈の平滑筋を弛緩させ、冠血管スパズムの発現を抑制するため、アセチルコリン負荷検査の結果に大きな影響を与えます。その他の薬剤は直接的に冠血管反応性に影響を及ぼさないため、選択肢としてはcが正解です。,1.0,c,アセチルコリン負荷試験は、冠攣縮を誘発して診断する検査である。カルシウム拮抗薬は冠動脈を拡張させる作用があり、アセチルコリンによる冠攣縮を抑制する可能性があるため、検査結果に影響を与える。,0.9,ERROR,Expecting value: line 1 column 1 (char 0),c,アセチルコリン負荷冠動脈造影検査は冠攣縮性狭心症の診断に用いられます。カルシウム拮抗薬は冠攣縮を抑制する作用があるため、検査結果に影響を与える（偽陰性となる可能性がある）ため、検査前に中止する必要があります。他の薬剤（スタチン、dpp-4阻害薬、ビスホスホネート製剤、arb）は検査結果に直接的な影響を与えません。,0.9,
119A58,54歳の男性。下痢を主訴に来院した。2か月前から下痢が出現し軽快しないため受診した。便回数は1日に6~7回、便性状は泥状から水様であり、揚げ物を食べると脂肪便を認める。便に血液の付着はない。飲酒は日本酒6合/日を34年間。身長174cm、体重58kg。血圧132/70mmHg。腹部は平坦、軟で圧痛を認めない。腸雑音はやや亢進している。血液生化学所見:アミラーゼ28U/L(基準44~132)、空腹時血糖140mg/dL、CEA3.0ng/mL(基準5以下)、CA19-937U/mL(基準37以下)。腹部単純CT(別冊No.23)を別に示す。禁酒の指導に加え、この患者に対して行う対応はどれか。 ,a. 低脂肪食 | b. 利胆薬の投与 | c. 消化酵素薬の投与 | d. 酸分泌抑制薬の投与 | e. 体外衝撃波結石破砕術〈ESWL〉,c,長期大量飲酒による慢性膵炎によって外分泌不全が生じ、脂肪便をきたしているため、消化酵素薬の投与が適切と判断した。,1.0,c,この患者の症状は慢性膵炎と一致しており、脂肪便や消化不良があることから、膵酵素の不足が示唆されます。したがって、消化酵素薬の投与が適切です。,0.9,c,この患者は長期間の大量飲酒歴とct所見（慢性膵炎を示唆する所見）に加え、脂肪摂取後に脂肪便が出現していることから、膵外分泌不全による消化不良が考えられる。膵酵素の補充療法が適切な対応となる。,1.0,c,ct画像から膵臓に異常（膵石灰化や膵管拡張など）が疑われ、アルコール多飲歴もあることから慢性膵炎が考えられる。慢性膵炎による膵外分泌不全のため脂肪便を認めていると考えられるため、消化酵素薬の投与が適切。,0.9,ERROR,Expecting value: line 1 column 1 (char 0),c,この症例は慢性アルコール性膵炎が強く疑われます。長期大量飲酒歴、脂肪便、ctでの膵臓の石灰化所見、低アミラーゼ値が特徴的です。膵外分泌機能が低下しているため、消化酵素薬の投与が適切な治療となります。これにより、消化吸収障害の改善が期待できます。,0.9,
119A59,"69歳の女性。2週間前に受けた人間ドックの腹部超音波検査で胆囊の異常を指摘され精査目的で来院した。自覚症状はない。喫煙歴はない。飲酒は機会飲酒。家族歴に特記すべきことはない。身長164cm、体重57kg。心音と呼吸音とに異常を認めない。腹部に異常所見を認めない。血液所見:赤血球507万、Hb14.7g/dL、Ht45%、白血球6,180。血液生化学所見:総蛋白6.8g/dL、アルブミン3.9g/dL、総ビリルビン0.6mg/dL、AST16U/L、ALT14U/L、LD160U/L(基準124~222)、ALP61U/L(基準38~113)、Y-GT17U/L(基準9~32)、アミラーゼ51U/L(基準44~132)、尿素窒素12mg/dL、クレアチニン0.8mg/dL、CEA2.5ng/mL(基準5以下)、CA19-928U/mL(基準37以下)。CRP1.0mg/dL。腹部造影CTで胆囊内に腫瘤があり、精査のために行った超音波内視鏡検査の胆囊像(別冊No.24)を別に示す。この患者に行う治療はどれか。 ",a. 胆囊摘出術 | b. 放射線治療 | c. 利胆薬投与 | d. 薬物による抗癌治療 | e. 超音波検査による経過観察,a,画像所見や腫瘍の存在から胆囊病変が疑われ、悪性の可能性を否定できないため胆囊摘出術が適切と判断される。,0.9,a,患者は無症状ですが、腹部造影ctで胆囊内に腫瘤が認められているため、悪性の可能性が考えられます。無症候性でも胆囊に腫瘍が認められた場合は、胆嚢癌のリスクを考慮して、一般的には胆囊摘出術が推奨されます。他の治療法は、腫瘍の性質がさらに明確になった場合に検討されますが、診断目的および潜在的に治療目的での外科的介入がこの状況では適切です。,0.9,a,この患者は偶発的に発見された胆嚢内腫瘤があり、eusで詳細な評価を行った結果、悪性腫瘍の可能性が高いと考えられるため、最も適切な治療は胆嚢摘出術となる。,1.0,a,胆嚢に腫瘤があり、悪性腫瘍の可能性が高いため、胆嚢摘出術が推奨される。自覚症状がないことや、腫瘍の大きさ、進展度合いによって手術適応を判断する。画像所見から、他の選択肢よりも外科的切除が最も適切な治療法と考えられる。,0.9,ERROR,Expecting value: line 1 column 1 (char 0),a,この症例では、以下の理由から胆囊摘出術が最適な治療法です：,0.9,
119A60,"13歳の女子。右膝周囲の痛みを主訴に来院した。3か月前から右膝周囲の痛みが出現し、痛みが増強したため受診した。外傷の既往はない。身長152cm、体重42kg。BMI18.1。体温36.5℃。右大腿遠位に軽度の腫脹と圧痛を認める。赤沈12mm/1時間。血液所見:Hb12.8g/dL、白血球8,200、血小板26万。CRP0.3mg/dL。右大腿遠位のエックス線写真(別冊No.25)を別に示す。適切な対応はどれか。 ",a. 生検 | b. 切開排膿術 | c. アスピリン投与 | d. 観血的整復固定術 | e. ギプスシーネ固定,a,3か月にわたる疼痛とx線上の腫瘍性病変の疑いがあり、感染所見も乏しいため、確定診断のために生検が適切と考えられる。,0.9,a,患者は13歳の少女で、右大腿遠位に腫脹と圧痛があり、外傷の既往がないことから、骨や軟部組織の腫瘍を疑う必要があります。赤沈やcrpの上昇が軽度で、感染症の可能性が低いため、腫瘍性病変の鑑別のために生検が適切な対応です。,0.9,a,この症例は13歳の女児で、外傷歴なく3か月続く右大腿遠位部の痛みと局所腫脹が認められており、エックス線所見も異常を示しているため、骨腫瘍（例：骨肉腫）の可能性が高いです。血液検査に感染性を示す所見がないことから、切開排膿術やその他の外傷・感染に対する処置は適応外となり、最終診断を確定するために生検による組織診断が適切と考えられます。,0.95,a,エックス線写真から骨腫瘍が疑われるため、確定診断のために生検を行うのが適切。,0.9,ERROR,Expecting value: line 1 column 1 (char 0),a,エックス線写真と臨床所見から骨肉腫が疑われます。思春期の大腿遠位部の痛み、腫脹、エックス線での骨破壊像が特徴的です。確定診断のために生検が必要です。炎症所見が軽度であることから感染症は否定的で、外傷歴もないため、整復固定やギプス固定は不適切です。,0.9,
119A61,16歳の男子。発熱と皮疹を主訴に来院した。幼少期からアトピー性皮膚炎で治療を受けていたが、3か月前から治療を中断していた。2日前から39.9℃の発熱があり、顔面に皮疹が出現し体幹にも拡大したため受診した。疼痛はない。顔面と体幹に小水疱、びらん及び紅斑を両側性に認めた。顔面の写真(別冊No.26)を別に示す。原因で最も考えられるのはどれか。 ,a. サイトメガロウイルス | b. 単純ヘルペスウイルス | c. 水痘·帯状疱疹ウイルス | d. ヒトヘルペスウイルス6 | e. Epstein-Barr〈EB〉ウイルス,b,アトピー性皮膚炎患者に全身性の小水疱・びらんを伴う発疹が発熱とともに出現する場合、単純ヘルペスウイルスによるカポジ水痘様発疹症が最も考えられるため。,1.0,b,アトピー性皮膚炎の患者が治療を中断した場合、免疫抑制が弱まり、単純ヘルペスウイルスによる全身性の皮疹が起こる可能性があります。特に発熱と全身の水疱のパターンは、カポジ水痘様発疹症（kaposi's varicelliform eruption）と呼ばれる、単純ヘルペスウイルスの感染症の典型的な症状に一致します。,0.9,b,この患者は、治療中断により悪化しやすいアトピー性皮膚炎の既往があり、急性発熱と顔面から体幹にかけて広がる小水疱、びらん、紅斑が認められることから、湿疹上に起こるヘルペスウイルス感染（カポジ風疹様発疹＝eczema herpeticum）が疑われ、最も考えられる原因は単純ヘルペスウイルスである。,1.0,b,アトピー性皮膚炎の既往があり、発熱と小水疱、びらん、紅斑が顔面や体幹に広がることから、カポジ水痘様発疹症（単純ヘルペスウイルス感染症）が最も考えられる。,0.9,ERROR,Expecting value: line 1 column 1 (char 0),b,アトピー性皮膚炎患者で治療中断後に発症した発熱と水疱性皮疹は、カポジ水痘様発疹症を強く示唆します。これは単純ヘルペスウイルスによる重症感染症で、アトピー性皮膚炎患者で特に発症リスクが高くなります。両側性の小水疱、びらんの分布と臨床経過が典型的です。,0.9,
